[
  {
    "id": "bluetooth",
    "label": "Bluetooth / BLE / GATT",
    "domain": "embedded",
    "featured": true,
    "display_version": "Classic + BLE 4.x · custom GATT",
    "notes": "Heavy use across career: Ingenico payment terminals, then Good Angel connected breathalyzer — designed GATT protocols, custom cross-platform Bluetooth stack (iOS CoreBluetooth + Android).",
    "versions": []
  },
  {
    "id": "nfc",
    "label": "NFC",
    "domain": "embedded",
    "display_version": "ISO 14443 / 15693 (Mifare)",
    "notes": "Ingenico mobile payment (Mifare Ultralight), Ondeo Gazpar meters.",
    "versions": []
  },
  {
    "id": "gps",
    "label": "GPS",
    "domain": "embedded",
    "display_version": "NMEA · A-GPS",
    "notes": "GoodKap connected GPS appliances, Neurones speed-limit service.",
    "versions": []
  },
  {
    "id": "computer-vision",
    "label": "Computer Vision (embedded)",
    "domain": "embedded",
    "display_version": "Industrial camera · PIC16F1938",
    "notes": "French Robotics Cup final-year project: embedded vision and robot positioning, 28th/200+ teams.",
    "versions": []
  },
  {
    "id": "gprs",
    "label": "GPRS",
    "domain": "embedded",
    "versions": []
  },
  {
    "id": "usb-driver",
    "label": "USB drivers",
    "domain": "embedded",
    "versions": []
  },
  {
    "id": "driver-development",
    "label": "Driver development",
    "domain": "embedded",
    "versions": []
  },
  {
    "id": "pic-microcontroller",
    "label": "PIC microcontrollers",
    "domain": "embedded",
    "versions": []
  },
  {
    "id": "augmented-reality",
    "label": "Augmented reality",
    "domain": "embedded",
    "versions": []
  },
  {
    "id": "mqtt",
    "label": "MQTT",
    "domain": "embedded",
    "versions": []
  },
  {
    "id": "objective-c",
    "label": "Objective-C",
    "domain": "mobile",
    "display_version": "iOS 5 → 10",
    "notes": "Native iOS NFC libraries (Ingenico, used downstream by Nespresso) and early Xamarin.iOS bindings.",
    "versions": [
      { "id": "objective_c_ios", "version": "iOS 5-10", "since": 2011 }
    ]
  },
  {
    "id": "xamarin-forms",
    "label": "Xamarin.Forms",
    "domain": "mobile",
    "display_version": "Forms 2.3 → 4.7 · Essentials 1.x",
    "notes": "Cross-platform iOS/Android for Good Angel & My Good Life products. Forms + platform bindings + Essentials.",
    "versions": [
      { "id": "xamarin_forms_2_3", "version": "Forms 2.3", "since": 2016 },
      { "id": "xamarin_forms_4_7", "version": "Forms 4.7", "since": 2020 }
    ]
  },
  {
    "id": "windows-mobile",
    "label": "Windows Mobile",
    "domain": "mobile",
    "display_version": "6.x",
    "notes": "Ondeo Gazpar meter configuration chain (NFC under Windows Mobile 6).",
    "versions": []
  },
  {
    "id": "windows-ce",
    "label": "Windows CE",
    "domain": "mobile",
    "display_version": "5.0 / 6.0",
    "notes": "Gunnebo deposit machines (100+ units), GoodKap GPS, Neurones, Ingenico IPA280.",
    "versions": [
      { "id": "windows_ce_5_0", "version": "5.0", "since": 2009 },
      { "id": "windows_ce_6_0", "version": "6.0", "since": 2010 }
    ]
  },
  {
    "id": "xamarin",
    "label": "Xamarin (iOS, Android)",
    "domain": "mobile",
    "versions": []
  },
  {
    "id": "android",
    "label": "Android",
    "domain": "mobile",
    "versions": []
  },
  {
    "id": "ios",
    "label": "iOS",
    "domain": "mobile",
    "versions": []
  },
  {
    "id": "mobile-release",
    "label": "Mobile release (signing, stores)",
    "domain": "mobile",
    "versions": []
  },
  {
    "id": "mobile-ui",
    "label": "Mobile UI",
    "domain": "mobile",
    "versions": []
  },
  {
    "id": "cross-platform-architecture",
    "label": "Cross-platform architecture",
    "domain": "mobile",
    "versions": []
  },
  {
    "id": "swift",
    "label": "Swift",
    "domain": "mobile",
    "versions": []
  },
  {
    "id": "maui",
    "label": ".NET MAUI",
    "domain": "mobile",
    "versions": []
  },
  {
    "id": "windows-services",
    "label": "Windows services",
    "domain": "desktop",
    "versions": []
  },
  {
    "id": "windows-rt",
    "label": "Windows RT",
    "domain": "desktop",
    "versions": []
  },
  {
    "id": "pinvoke-interop",
    "label": "P/Invoke interop",
    "domain": "desktop",
    "versions": []
  },
  {
    "id": "winforms",
    "label": "Windows Forms",
    "domain": "desktop",
    "versions": []
  },
  {
    "id": "csharp-dotnet",
    "label": "C# / .NET",
    "domain": "languages",
    "featured": true,
    "display_version": "C# 2.0 → 13 · .NET Framework 2.0 → .NET 10",
    "notes": "Daily driver since 2006. Cross-era: Framework 2.0 to .NET 10, desktop, mobile, backend, tooling.",
    "versions": [
      { "id": "csharp_2_0", "version": "C# 2.0", "since": 2006 },
      { "id": "dotnet_framework_2", "version": ".NET Framework 2.0", "since": 2006 },
      { "id": "dotnet_framework_4", "version": ".NET Framework 4.x", "since": 2010 },
      { "id": "csharp_8", "version": "C# 8", "since": 2019 },
      { "id": "dotnet_5", "version": ".NET 5", "since": 2020 },
      { "id": "dotnet_6", "version": ".NET 6", "since": 2021 },
      { "id": "csharp_10", "version": "C# 10", "since": 2021 },
      { "id": "csharp_12", "version": "C# 12", "since": 2023 },
      { "id": "dotnet_8", "version": ".NET 8", "since": 2024 },
      { "id": "dotnet_10", "version": ".NET 10", "since": 2026 }
    ]
  },
  {
    "id": "python",
    "label": "Python",
    "domain": "languages",
    "featured": true,
    "display_version": "3.11+",
    "notes": "PyScaffold projects, FastAPI, LLM/crypto tooling, AST refactoring, PyPI publishing.",
    "versions": [
      { "id": "python_3_11", "version": "3.11", "since": 2023 }
    ]
  },
  {
    "id": "c-cpp",
    "label": "C / C++",
    "domain": "languages",
    "display_version": "C99 · C++11 · C++/CLI",
    "notes": "Embedded era — robotics (PIC), Windows CE, NFC drivers, AIX monitoring, augmented reality (C++/CLI).",
    "versions": [
      { "id": "c_99", "version": "C99", "since": 2006 },
      { "id": "cpp_11", "version": "C++11", "since": 2008 },
      { "id": "cpp_cli", "version": "C++/CLI", "since": 2013 }
    ]
  },
  {
    "id": "bash",
    "label": "Bash / Shell",
    "domain": "languages",
    "display_version": "Bash 5.x",
    "notes": "Docker automation, CI scripts, blockchain node tooling, devcontainers.",
    "versions": [
      { "id": "bash_5", "version": "5.x", "since": 2020 }
    ]
  },
  {
    "id": "typescript",
    "label": "TypeScript",
    "domain": "languages",
    "display_version": "5.x",
    "notes": "Node.js bots (Claude/Kalshi), React/Next.js front-ends.",
    "versions": [
      { "id": "typescript_5", "version": "5.x", "since": 2024 }
    ]
  },
  {
    "id": "java",
    "label": "Java",
    "domain": "languages",
    "versions": []
  },
  {
    "id": "multithreading",
    "label": "Multithreading",
    "domain": "languages",
    "versions": []
  },
  {
    "id": "sql",
    "label": "SQL",
    "domain": "languages",
    "versions": []
  },
  {
    "id": "xaml",
    "label": "XAML",
    "domain": "languages",
    "versions": []
  },
  {
    "id": "web",
    "label": "HTML / CSS",
    "domain": "languages",
    "versions": []
  },
  {
    "id": "cpp-cli",
    "label": "C++/CLI",
    "domain": "languages",
    "versions": []
  },
  {
    "id": "matlab",
    "label": "MATLAB",
    "domain": "languages",
    "versions": []
  },
  {
    "id": "javascript",
    "label": "JavaScript",
    "domain": "languages",
    "versions": []
  },
  {
    "id": "go",
    "label": "Go",
    "domain": "languages",
    "versions": []
  },
  {
    "id": "powershell",
    "label": "PowerShell",
    "domain": "languages",
    "versions": []
  },
  {
    "id": "ruby",
    "label": "Ruby",
    "domain": "languages",
    "versions": []
  },
  {
    "id": "dart",
    "label": "Dart",
    "domain": "languages",
    "versions": []
  },
  {
    "id": "kotlin",
    "label": "Kotlin",
    "domain": "languages",
    "versions": []
  },
  {
    "id": "php",
    "label": "PHP",
    "domain": "languages",
    "versions": []
  },
  {
    "id": "rust",
    "label": "Rust",
    "domain": "languages",
    "versions": []
  },
  {
    "id": "asp-net-core",
    "label": "ASP.NET Core",
    "domain": "backend",
    "display_version": "2.2 → 8",
    "notes": "REST APIs, minimal APIs, Swagger/OpenAPI, modular architectures.",
    "versions": [
      { "id": "asp_net_core_2_2", "version": "2.2", "since": 2019 },
      { "id": "asp_net_core_3_1", "version": "3.1", "since": 2020 },
      { "id": "asp_net_core_8", "version": "8", "since": 2024 }
    ]
  },
  {
    "id": "asp-net-web-api-2",
    "label": "ASP.NET Web API 2",
    "domain": "backend",
    "display_version": "Framework 4.x",
    "notes": "Good Angel platform — JWT-secured REST API. SOAP web services at GoodKap/Ondeo.",
    "versions": []
  },
  {
    "id": "blazor",
    "label": "Blazor (WASM & Server)",
    "domain": "backend",
    "display_version": ".NET 6+",
    "notes": "BlazorHero + MudBlazor + CQRS, dashboards, DDD apps.",
    "versions": []
  },
  {
    "id": "ef-core",
    "label": "Entity Framework",
    "domain": "backend",
    "display_version": "EF6 → EF Core 3.1+",
    "notes": "DDD-friendly data layer; migrated EF6 to EF Core on health and FFBB projects.",
    "versions": [
      { "id": "ef_6", "version": "EF6 (6.1.3)", "since": 2016 },
      { "id": "ef_core_3_1", "version": "EF Core 3.1", "since": 2020 }
    ]
  },
  {
    "id": "fastapi",
    "label": "FastAPI",
    "domain": "backend",
    "display_version": "0.110+",
    "notes": "LLM gateways, basketball coaching backend.",
    "versions": []
  },
  {
    "id": "nodejs",
    "label": "Node.js",
    "domain": "backend",
    "display_version": "20 / 22 / 24",
    "notes": "Express, Socket.io, Claude SDK, Kalshi integrations.",
    "versions": []
  },
  {
    "id": "react-next",